{
  "$schema": "https://json-schema.org/draft/2020-12/schema",
  "$id": "https://schemas.socioprophet.org/functional-model-surfaces/trust-gate-policy.v1.json",
  "title": "SocioProphet Trust Gate Policy",
  "description": "Policy contract that converts TrustOps receipts into promotion, routing, guardrail, rollback, and agent-authority actions.",
  "type": "object",
  "additionalProperties": false,
  "required": [
    "schemaVersion",
    "policyId",
    "scope",
    "gates",
    "defaultAction",
    "owners"
  ],
  "properties": {
    "schemaVersion": {
      "type": "string",
      "const": "trust-gate-policy.v1"
    },
    "policyId": {
      "type": "string",
      "pattern": "^trustgate\\.[a-z0-9][a-z0-9_.:-]+$"
    },
    "scope": {
      "type": "object",
      "additionalProperties": false,
      "required": [
        "appliesTo"
      ],
      "properties": {
        "appliesTo": {
          "type": "array",
          "items": {
            "type": "string",
            "enum": [
              "model",
              "adapter",
              "dataset",
              "rag-package",
              "agent",
              "tool",
              "functional-service",
              "route-policy"
            ]
          }
        },
        "ownerRepositories": {
          "type": "array",
          "items": {
            "type": "string",
            "pattern": "^[A-Za-z0-9_.-]+/[A-Za-z0-9_.-]+$"
          }
        },
        "runtimeProfiles": {
          "type": "array",
          "items": {
            "type": "string"
          }
        }
      }
    },
    "gates": {
      "type": "array",
      "minItems": 1,
      "items": {
        "type": "object",
        "additionalProperties": false,
        "required": [
          "gateId",
          "receiptTypes",
          "requiredStatus",
          "onPass",
          "onWarn",
          "onFail"
        ],
        "properties": {
          "gateId": {
            "type": "string"
          },
          "receiptTypes": {
            "type": "array",
            "items": {
              "type": "string",
              "enum": [
                "fairness",
                "robustness",
                "explanation",
                "uncertainty",
                "ranking-fairness",
                "rag-trust",
                "agent-trust",
                "dataset-risk"
              ]
            }
          },
          "requiredStatus": {
            "type": "string",
            "enum": [
              "pass",
              "warn-allowed",
              "review-allowed"
            ]
          },
          "minimumFreshnessDays": {
            "type": "integer",
            "minimum": 1
          },
          "requiredMetricStatuses": {
            "type": "array",
            "items": {
              "type": "string"
            }
          },
          "onPass": {
            "type": "string",
            "enum": [
              "allow",
              "record",
              "route-primary"
            ]
          },
          "onWarn": {
            "type": "string",
            "enum": [
              "warn",
              "require-review",
              "route-fallback",
              "quarantine"
            ]
          },
          "onFail": {
            "type": "string",
            "enum": [
              "block",
              "quarantine",
              "rollback",
              "revoke"
            ]
          },
          "waiverAllowed": {
            "type": "boolean"
          }
        }
      }
    },
    "defaultAction": {
      "type": "string",
      "enum": [
        "block",
        "require-review",
        "warn"
      ]
    },
    "owners": {
      "type": "array",
      "items": {
        "type": "string"
      },
      "minItems": 1
    },
    "standardsCrosswalk": {
      "type": "array",
      "items": {
        "type": "object",
        "additionalProperties": false,
        "required": [
          "standard",
          "controlRefs"
        ],
        "properties": {
          "standard": {
            "type": "string"
          },
          "controlRefs": {
            "type": "array",
            "items": {
              "type": "string"
            }
          }
        }
      }
    }
  }
}
